{
  "schema_version": "0.1.0",
  "evidence_id": "22222222-2222-4222-8222-222222222222",
  "kind": "commissioning",
  "subject": {
    "cell_id": "0d3c6b63-a57f-4207-8638-e4cf76efec90",
    "component_instance_id": "gripper-001",
    "test_name": "gripper_pneumatic_bench_actuation"
  },
  "created_at": "2026-08-19T00:00:00Z",
  "valid_until": "2027-08-19T00:00:00Z",
  "issuer": "automation-engineer@cellforge.local",
  "artifact_sha256": "bbbbbbbbbbbbbbbbbbbbbbbbbbbbbbbbbbbbbbbbbbbbbbbbbbbbbbbbbbbbbbbb",
  "signature": "mock-ed25519-signature-gripper-bench"
}
