{
  "schema_version": "0.1.0",
  "evidence_id": "33333333-3333-4333-8333-333333333333",
  "kind": "commissioning",
  "subject": {
    "cell_id": "0d3c6b63-a57f-4207-8638-e4cf76efec90",
    "component_instance_id": "fixture-001",
    "test_name": "fixture_seating_debounce_verification"
  },
  "created_at": "2026-08-19T00:00:00Z",
  "valid_until": "2027-08-19T00:00:00Z",
  "issuer": "automation-engineer@cellforge.local",
  "artifact_sha256": "cccccccccccccccccccccccccccccccccccccccccccccccccccccccccccccccc",
  "signature": "mock-ed25519-signature-fixture-bench"
}
