{
  "schema_version": "0.1.0",
  "evidence_id": "11111111-1111-4111-8111-111111111111",
  "kind": "commissioning",
  "subject": {
    "cell_id": "0d3c6b63-a57f-4207-8638-e4cf76efec90",
    "component_instance_id": "robot-001",
    "test_name": "robot_motion_bench_trajectory"
  },
  "created_at": "2026-08-19T00:00:00Z",
  "valid_until": "2027-08-19T00:00:00Z",
  "issuer": "automation-engineer@cellforge.local",
  "artifact_sha256": "aaaaaaaaaaaaaaaaaaaaaaaaaaaaaaaaaaaaaaaaaaaaaaaaaaaaaaaaaaaaaaaa",
  "signature": "mock-ed25519-signature-robot-bench"
}
