{
  "schema_version": "0.1.0",
  "evidence_id": "77777777-7777-4777-8777-777777777777",
  "kind": "commissioning",
  "subject": {
    "cell_id": "0d3c6b63-a57f-4207-8638-e4cf76efec90",
    "report_name": "on_cell_hardware_commissioning_acceptance"
  },
  "created_at": "2026-08-19T00:00:00Z",
  "valid_until": "2027-08-19T00:00:00Z",
  "issuer": "lead-commissioning-engineer@cellforge.local",
  "artifact_sha256": "7777777777777777777777777777777777777777777777777777777777777777",
  "signature": "mock-ed25519-signature-commissioning-report"
}
