{
  "schema_version": "0.1.0",
  "evidence_id": "44444444-4444-4444-8444-444444444444",
  "kind": "commissioning",
  "subject": {
    "cell_id": "0d3c6b63-a57f-4207-8638-e4cf76efec90",
    "component_instance_id": "camera-001",
    "test_name": "camera_localization_contrast_inspection"
  },
  "created_at": "2026-08-19T00:00:00Z",
  "valid_until": "2027-08-19T00:00:00Z",
  "issuer": "automation-engineer@cellforge.local",
  "artifact_sha256": "dddddddddddddddddddddddddddddddddddddddddddddddddddddddddddddddd",
  "signature": "mock-ed25519-signature-camera-bench"
}
