{
  "schema_version": "0.1.0",
  "evidence_id": "55555555-5555-4555-8555-555555555555",
  "kind": "commissioning",
  "subject": {
    "cell_id": "0d3c6b63-a57f-4207-8638-e4cf76efec90",
    "component_instance_id": "laser-001",
    "test_name": "laser_marker_handshake_uncertain_outcome"
  },
  "created_at": "2026-08-19T00:00:00Z",
  "valid_until": "2027-08-19T00:00:00Z",
  "issuer": "automation-engineer@cellforge.local",
  "artifact_sha256": "eeeeeeeeeeeeeeeeeeeeeeeeeeeeeeeeeeeeeeeeeeeeeeeeeeeeeeeeeeeeeeee",
  "signature": "mock-ed25519-signature-laser-bench"
}
