{
  "schema_version": "0.1.0",
  "evidence_id": "88888888-8888-4888-8888-888888888888",
  "kind": "safety_review",
  "subject": {
    "cell_id": "0d3c6b63-a57f-4207-8638-e4cf76efec90",
    "component_instance_id": "safety-status-001",
    "assessment": "independent_functional_safety_review_iso_13849_cat4_pled"
  },
  "created_at": "2026-08-19T00:00:00Z",
  "valid_until": "2027-08-19T00:00:00Z",
  "issuer": "certified-functional-safety-engineer@cellforge.local",
  "artifact_sha256": "8888888888888888888888888888888888888888888888888888888888888888",
  "signature": "mock-ed25519-signature-safety-review"
}
