{
  "schema_version": "0.1.0",
  "evidence_id": "00000000-0000-4000-8000-000000000000",
  "kind": "simulation",
  "subject": {
    "cell_id": "0d3c6b63-a57f-4207-8638-e4cf76efec90",
    "scenario_name": "nominal_simulation_l2"
  },
  "created_at": "2026-08-19T00:00:00Z",
  "valid_until": "2027-08-19T00:00:00Z",
  "issuer": "simulation-engineer@cellforge.local",
  "artifact_sha256": "0000000000000000000000000000000000000000000000000000000000000000",
  "signature": "mock-ed25519-signature-simulation"
}
