{
  "schema_version": "0.1.0",
  "evidence_id": "99999999-9999-4999-8999-999999999999",
  "kind": "calibration",
  "subject": {
    "cell_id": "0d3c6b63-a57f-4207-8638-e4cf76efec90",
    "component_instance_id": "camera-001",
    "calibration_file": "calibration/camera_extrinsics.json"
  },
  "created_at": "2026-08-19T00:00:00Z",
  "valid_until": "2027-08-19T00:00:00Z",
  "issuer": "metrology-engineer@cellforge.local",
  "artifact_sha256": "9999999999999999999999999999999999999999999999999999999999999999",
  "signature": "mock-ed25519-signature-calibration"
}
